{
  "$schema": "https://json-schema.org/draft/2020-12/schema",
  "$id": "https://rembrane.dev/spec/security-review-attestation.schema.json",
  "title": "Rembrane Independent Security Review Attestation",
  "type": "object",
  "additionalProperties": false,
  "required": [
    "schemaVersion",
    "sourceRevision",
    "manifestSha256",
    "reviewedAt",
    "reviewer",
    "scope",
    "findings",
    "disposition"
  ],
  "properties": {
    "schemaVersion": {
      "const": 1
    },
    "sourceRevision": {
      "type": "string",
      "pattern": "^[0-9a-f]{40}$"
    },
    "manifestSha256": {
      "type": "string",
      "pattern": "^[0-9a-f]{64}$"
    },
    "reviewedAt": {
      "type": "string",
      "format": "date-time",
      "maxLength": 20,
      "pattern": "^\\d{4}-\\d{2}-\\d{2}T\\d{2}:\\d{2}:\\d{2}Z$"
    },
    "reviewer": {
      "type": "object",
      "additionalProperties": false,
      "required": ["id", "independent"],
      "properties": {
        "id": {
          "type": "string",
          "minLength": 1,
          "maxLength": 200,
          "pattern": "^[!-~](?:[ -~]*[!-~])?$"
        },
        "organization": {
          "type": "string",
          "minLength": 1,
          "maxLength": 200,
          "pattern": "^[!-~](?:[ -~]*[!-~])?$"
        },
        "independent": {
          "const": true
        }
      }
    },
    "scope": {
      "type": "object",
      "additionalProperties": false,
      "required": ["manifestFileCount", "exclusions"],
      "properties": {
        "manifestFileCount": {
          "type": "integer",
          "minimum": 1,
          "maximum": 10000
        },
        "exclusions": {
          "type": "array",
          "maxItems": 100,
          "uniqueItems": true,
          "items": {
            "type": "string",
            "minLength": 1,
            "maxLength": 500,
            "pattern": "^[!-~](?:[ -~]*[!-~])?$"
          }
        }
      }
    },
    "findings": {
      "type": "object",
      "additionalProperties": false,
      "required": [
        "critical",
        "high",
        "moderate",
        "low",
        "informational",
        "unresolved"
      ],
      "properties": {
        "critical": {
          "type": "integer",
          "minimum": 0,
          "maximum": 1000000
        },
        "high": {
          "type": "integer",
          "minimum": 0,
          "maximum": 1000000
        },
        "moderate": {
          "type": "integer",
          "minimum": 0,
          "maximum": 1000000
        },
        "low": {
          "type": "integer",
          "minimum": 0,
          "maximum": 1000000
        },
        "informational": {
          "type": "integer",
          "minimum": 0,
          "maximum": 1000000
        },
        "unresolved": {
          "type": "integer",
          "minimum": 0,
          "maximum": 1000000
        }
      }
    },
    "disposition": {
      "enum": [
        "approved",
        "approved_with_accepted_risks",
        "changes_required"
      ]
    },
    "reportReference": {
      "type": "string",
      "minLength": 1,
      "maxLength": 500,
      "pattern": "^[!-~](?:[ -~]*[!-~])?$"
    }
  },
  "allOf": [
    {
      "if": {
        "properties": {
          "disposition": {
            "const": "approved"
          }
        },
        "required": ["disposition"]
      },
      "then": {
        "properties": {
          "scope": {
            "properties": {
              "exclusions": {
                "maxItems": 0
              }
            }
          },
          "findings": {
            "properties": {
              "unresolved": {
                "const": 0
              }
            }
          }
        }
      }
    },
    {
      "if": {
        "properties": {
          "disposition": {
            "const": "approved_with_accepted_risks"
          }
        },
        "required": ["disposition"]
      },
      "then": {
        "properties": {
          "findings": {
            "properties": {
              "unresolved": {
                "const": 0
              }
            }
          }
        }
      }
    },
    {
      "if": {
        "properties": {
          "disposition": {
            "const": "changes_required"
          }
        },
        "required": ["disposition"]
      },
      "then": {
        "properties": {
          "findings": {
            "properties": {
              "unresolved": {
                "minimum": 1
              }
            }
          }
        }
      }
    }
  ]
}
