{
  "schemaVersion": 1,
  "sourceRevision": "1111111111111111111111111111111111111111",
  "manifestSha256": "aaaaaaaaaaaaaaaaaaaaaaaaaaaaaaaaaaaaaaaaaaaaaaaaaaaaaaaaaaaaaaaa",
  "reviewedAt": "2026-01-15T12:00:00Z",
  "reviewer": {
    "id": "example-independent-reviewer",
    "organization": "Example Security Lab",
    "independent": true
  },
  "scope": {
    "manifestFileCount": 418,
    "exclusions": []
  },
  "findings": {
    "critical": 0,
    "high": 0,
    "moderate": 0,
    "low": 0,
    "informational": 0,
    "unresolved": 0
  },
  "disposition": "approved",
  "reportReference": "example-report-reference"
}
